<?xml version="1.0" encoding="utf-8"?>
<invoices xmlns:xsi="http://www.w3.org/2001/XMLSchema-instance" xsi:noNamespaceSchemaLocation="invoice.xsd">
<invoice id="inv001">
    <supplierId>123</supplierId>
    <date>2023-01-30</date>
    <status>paid</status>
    <items>
        <item>
            <productId>101</productId>
            <name>Product 1</name>
            <quantity>2</quantity>
            <price>50.00</price>
        </item>
        <item>
            <productId>102</productId>
            <name>Product 2</name>
            <quantity>1</quantity>
            <price>100.00</price>
        </item>
    </items>
    <total>200.00</total>
</invoice>

</invoices>